{
  "paper_id": "Roodt - 2021 - Subgroup Formation in Diverse Virtual Teams The Moderating Role o",
  "schema_version": "2.1",
  "annotation_provenance": {
    "origin": "unknown",
    "review_status": "unreviewed",
    "created_by": "unknown",
    "created_date": "",
    "model_id": null,
    "reviewed_by": null,
    "reviewed_date": null,
    "human_read_time_minutes": null,
    "model_run_time_seconds": null,
    "correction_time_minutes": null,
    "legacy_time_minutes": null
  },
  "metadata": {
    "title": {
      "value": null,
      "status": "pending",
      "quote": null,
      "page": null,
      "section": null,
      "fragment_id": null
    },
    "authors": {
      "value": null,
      "status": "pending",
      "quote": null,
      "page": null,
      "section": null,
      "fragment_id": null
    },
    "year": {
      "value": 2021,
      "status": "pending",
      "quote": null,
      "page": null,
      "section": null,
      "fragment_id": null
    },
    "journal": {
      "value": null,
      "status": "pending",
      "quote": null,
      "page": null,
      "section": null,
      "fragment_id": null
    },
    "doi": {
      "value": null,
      "status": "pending",
      "quote": null,
      "page": null,
      "section": null,
      "fragment_id": null
    },
    "paper_type_profile": "other",
    "publication_version": "unknown"
  },
  "studies": [],
  "key_findings": [],
  "theoretical_framework": [],
  "notes": ""
}